{
  "$schema": "https://json-schema.org/draft/2020-12/schema",
  "$id": "urn:learnops:contract:lesson-manifest:v1",
  "title": "LearnOps lesson manifest (B6, v1)",
  "description": "The lesson.json manifest in a lesson folder (PRD B6.2, B6.3). It lists the lesson's tracks and derived files. Every path is relative to the lesson folder (PRD B6.3, C-08). This schema checks structure only; rules that need the lesson folder or the configuration are listed under $comment and are enforced by validator code, not by this file.",
  "$comment": "Unknown fields are allowed on purpose: after Release 0 contracts change only by adding optional fields and readers ignore unknown fields (PRD B.0, EXT-02). Required here: the manifest fields that point to files B6.2 marks as required (the main track, captions, transcript, chapters). poster.jpg is required by B6.2 but the B6.3 manifest has no field for it, so it is found by its fixed file name in the lesson folder and is not described here. The fields course_slug, lesson_id, title, duration_s, source and processing appear in the B6.3 example but the PRD does not say whether they are required, so they are optional here and checked for type only when present (to be confirmed by the contract reviewers before the Release 0 freeze). NOT expressible in JSON Schema, so NOT enforced here: that the named files exist in the lesson folder; that lesson.json is written last, only when every required file exists (FR-V-08); that lesson_id and course_slug match the folder's place in the B6.1 path template (the template is configurable); the file names B6.2 gives (720p.mp4, captions.en.vtt and so on), since the manifest is what readers follow. processing.completed_at: the pattern guarantees the RFC 3339 shape and field ranges (month 01-12, day 01-31, hour 00-23 and so on) with any validator; calendar validity (for example no 31 February) is checked only by a validator run with a date-time format checker, which jsonschema provides only when the rfc3339-validator package is installed (it is not in requirements-dev.txt).",
  "type": "object",
  "required": ["schema", "tracks", "captions", "transcript", "chapters"],
  "properties": {
    "schema": {
      "const": "learnops.lesson/v1",
      "description": "Contract name and version."
    },
    "course_slug": {
      "$ref": "#/$defs/slug",
      "description": "The course slug used in the lesson's path (PRD B6.1, B1.1)."
    },
    "lesson_id": {
      "type": "string",
      "minLength": 1,
      "description": "The lesson's place below the course folder, for example 01-setup/02-install-python (PRD B6.3). Its form follows the configurable path template (B6.1), so this schema does not fix it."
    },
    "title": {
      "type": "string",
      "minLength": 1
    },
    "duration_s": {
      "type": "number",
      "minimum": 0,
      "description": "Length of the lesson in seconds."
    },
    "tracks": {
      "type": "array",
      "minItems": 1,
      "items": { "$ref": "#/$defs/track" },
      "contains": {
        "type": "object",
        "required": ["role"],
        "properties": { "role": { "const": "main" } }
      },
      "description": "Every video track of the lesson. A main track is required (PRD B6.2: 720p.mp4). camera and screen are reserved for F-1 and are listed, not played, in v1 (PRD B6.2, B6.3); a v1 reader ignores roles it doesn't play."
    },
    "captions": {
      "type": "array",
      "minItems": 1,
      "items": { "$ref": "#/$defs/caption" },
      "description": "WebVTT caption files (PRD B6.2: captions.en.vtt is required)."
    },
    "transcript": {
      "$ref": "#/$defs/relative_path",
      "description": "Segments with word timings, in the B5.4 shape (PRD B6.2)."
    },
    "chapters": {
      "$ref": "#/$defs/relative_path",
      "description": "Chapter list [{start, end, title}] (PRD B6.2)."
    },
    "slides": {
      "$ref": "#/$defs/relative_path",
      "description": "Slide-change index [{t, thumb, text?}] (PRD B6.2; optional, feature flag)."
    },
    "cues": {
      "$ref": "#/$defs/relative_path",
      "description": "Moments where an activity should appear [{t, type, ref, label}] (PRD B6.2; optional)."
    },
    "summary": {
      "$ref": "#/$defs/relative_path",
      "description": "Short summary in Markdown (PRD B6.2; optional, feature flag)."
    },
    "source": { "$ref": "#/$defs/source" },
    "processing": { "$ref": "#/$defs/processing" }
  },
  "$defs": {
    "slug": {
      "type": "string",
      "pattern": "^[a-z0-9]+(-[a-z0-9]+)*(?![\\s\\S])",
      "description": "Lowercase ASCII letters and digits separated by single hyphens (PRD B6.1, B1.1). The end anchor is (?![\\s\\S]) instead of $ because Python's $ also matches before a trailing newline."
    },
    "relative_path": {
      "type": "string",
      "pattern": "^(?![A-Za-z][A-Za-z0-9+.-]*:)(?!/)(?!(?:.*/)?\\.\\.(?:/|(?![\\s\\S])))[^\\\\\\n]+(?![\\s\\S])",
      "description": "Path relative to the lesson folder, with forward slashes. Not a URL, not absolute, no '..' segment (PRD B6.3, C-08)."
    },
    "track": {
      "type": "object",
      "required": ["role", "file"],
      "properties": {
        "role": {
          "enum": ["main", "main-low", "camera", "screen"],
          "description": "main: the main video (720p). main-low: the low-bandwidth copy (360p, optional). camera, screen: separate tracks reserved for F-1 (PRD B6.2, B6.3)."
        },
        "file": { "$ref": "#/$defs/relative_path" },
        "height": {
          "type": "integer",
          "minimum": 1,
          "description": "Frame height in pixels, for example 720 or 360."
        }
      }
    },
    "caption": {
      "type": "object",
      "required": ["lang", "file"],
      "properties": {
        "lang": {
          "type": "string",
          "minLength": 1,
          "description": "Caption language, for example en."
        },
        "file": { "$ref": "#/$defs/relative_path" }
      }
    },
    "source": {
      "type": "object",
      "required": ["kind"],
      "properties": {
        "kind": {
          "type": "string",
          "minLength": 1,
          "description": "Where the lesson came from. The PRD names only upload (B6.3); BigBlueButton intake (FR-V-09) is another source whose value the PRD does not name, so this is not an enum."
        },
        "uploaded_by": {
          "type": "string",
          "minLength": 1,
          "description": "The uploader's LTI sub (PRD B6.3, B3). No other personal data."
        },
        "original_name": {
          "type": "string",
          "minLength": 1,
          "description": "File name of the uploaded original."
        }
      }
    },
    "processing": {
      "type": "object",
      "properties": {
        "pipeline_version": {
          "type": "string",
          "minLength": 1,
          "description": "Version of the pipeline that produced the lesson; a re-process records a new one (FR-V-11)."
        },
        "completed_at": {
          "type": "string",
          "format": "date-time",
          "pattern": "^[0-9]{4}-(0[1-9]|1[0-2])-(0[1-9]|[12][0-9]|3[01])T([01][0-9]|2[0-3]):[0-5][0-9]:([0-5][0-9]|60)(\\.[0-9]+)?(Z|[+-]([01][0-9]|2[0-3]):[0-5][0-9])(?![\\s\\S])",
          "description": "When processing finished, as an RFC 3339 timestamp with a time zone."
        }
      }
    }
  }
}
